{
  "$schema": "https://json-schema.org/draft/2020-12/schema",
  "$id": "dsdk-evidence-packet-1",
  "title": "dsdk evidence packet",
  "description": "Machine-produced evidence for one curriculum track. Generic sections are checked here; `panels` is track-specific data that the viewer module viewer/<track>.mjs knows how to recompute and display.",
  "type": "object",
  "required": ["packet_version", "track", "title", "generated_at", "question", "input_snapshot",
               "implementation", "oracle", "run_record", "browser_artifact", "result", "panels"],
  "additionalProperties": false,
  "properties": {
    "packet_version": {"const": "1"},
    "track": {"type": "string", "pattern": "^[A-Z][0-9]+$"},
    "title": {"type": "string", "minLength": 1},
    "generated_at": {"type": "string", "pattern": "^\\d{4}-\\d{2}-\\d{2}T\\d{2}:\\d{2}:\\d{2}Z$"},
    "question": {
      "type": "object",
      "required": ["text", "competing_explanations", "scope"],
      "additionalProperties": false,
      "properties": {
        "text": {"type": "string", "minLength": 1},
        "competing_explanations": {"type": "array", "minItems": 2, "items": {"$ref": "#/$defs/explanation"}},
        "scope": {"type": "object", "required": ["claims", "does_not_claim"], "additionalProperties": false,
                  "properties": {"claims": {"type": "array", "minItems": 1, "items": {"type": "string"}},
                                 "does_not_claim": {"type": "array", "minItems": 1, "items": {"type": "string"}}}}
      }
    },
    "input_snapshot": {
      "type": "object",
      "required": ["source", "schema", "missingness_meaning", "files"],
      "additionalProperties": false,
      "properties": {
        "source": {"type": "string", "minLength": 1},
        "schema": {"type": "string", "minLength": 1},
        "missingness_meaning": {"type": "string", "minLength": 1},
        "files": {"type": "array", "minItems": 1, "items": {"$ref": "#/$defs/hashed_file"}}
      }
    },
    "implementation": {
      "type": "object",
      "required": ["module", "version", "config", "code_files", "fixtures"],
      "additionalProperties": false,
      "properties": {
        "module": {"type": "string", "minLength": 1},
        "version": {"type": "string"},
        "config": {"type": "object", "required": ["config_version"],
                   "properties": {"config_version": {"type": "string", "minLength": 1}}},
        "code_files": {"type": "array", "minItems": 1, "items": {"$ref": "#/$defs/hashed_file"}},
        "fixtures": {"type": "array", "minItems": 1,
                     "items": {"type": "object", "required": ["path", "sha256", "representative"],
                               "additionalProperties": false,
                               "properties": {"path": {"type": "string"}, "sha256": {"$ref": "#/$defs/sha256"},
                                              "representative": {"type": "array", "items": {"type": "string"}}}}}
      }
    },
    "oracle": {
      "type": "object",
      "required": ["analytic", "independent_reference", "boundary_cases", "deliberate_failures"],
      "additionalProperties": false,
      "properties": {
        "analytic": {"type": "array", "minItems": 1, "items": {"$ref": "#/$defs/check"}},
        "independent_reference": {
          "type": "object", "required": ["description", "comparisons"], "additionalProperties": false,
          "properties": {"description": {"type": "string", "minLength": 1},
                         "comparisons": {"type": "array", "minItems": 1,
                                         "items": {"type": "object",
                                                   "required": ["name", "compared", "mismatches"],
                                                   "properties": {"name": {"type": "string"},
                                                                  "compared": {"type": "integer"},
                                                                  "mismatches": {"type": "integer"}}}}}
        },
        "boundary_cases": {"type": "array", "minItems": 1, "items": {"$ref": "#/$defs/check"}},
        "deliberate_failures": {
          "type": "array", "minItems": 1,
          "items": {"type": "object",
                    "required": ["name", "description", "expected_to_fail", "failure_observed", "detail"],
                    "properties": {"name": {"type": "string"}, "description": {"type": "string"},
                                   "expected_to_fail": {"type": "boolean"},
                                   "failure_observed": {"type": "boolean"},
                                   "detail": {"type": "string"}}}
        }
      }
    },
    "run_record": {
      "type": "object",
      "required": ["git_sha", "working_tree_dirty", "environment", "data", "parameters", "random_seeds",
                   "random_draws", "tests", "outputs", "uncertainty", "timestamp"],
      "additionalProperties": false,
      "properties": {
        "git_sha": {"type": "string", "pattern": "^([0-9a-f]{40}|unknown)$"},
        "git_branch": {"type": "string"},
        "working_tree_dirty": {"type": "boolean"},
        "environment": {"type": "object", "required": ["python", "platform"]},
        "data": {"type": "array", "items": {"$ref": "#/$defs/hashed_file"}},
        "parameters": {"type": "object"},
        "random_seeds": {"type": "array"},
        "random_draws": {"type": "string"},
        "tests": {"type": "array", "minItems": 1,
                  "items": {"type": "object",
                            "required": ["target", "command", "exit_code", "summary", "passed", "failed"],
                            "properties": {"target": {"type": "string"}, "command": {"type": "string"},
                                           "exit_code": {"type": "integer"}, "summary": {"type": "string"},
                                           "passed": {"type": "integer"}, "failed": {"type": "integer"}}}},
        "outputs": {"type": "array", "minItems": 1, "items": {"type": "object", "required": ["path", "description"]}},
        "uncertainty": {"type": "string", "minLength": 1},
        "timestamp": {"type": "string", "pattern": "^\\d{4}-\\d{2}-\\d{2}T\\d{2}:\\d{2}:\\d{2}Z$"}
      }
    },
    "browser_artifact": {
      "type": "object",
      "required": ["viewer", "query", "recomputes_with", "views", "accessibility", "provenance_shown", "capture_record"],
      "additionalProperties": false,
      "properties": {
        "viewer": {"type": "string"},
        "query": {"type": "string"},
        "recomputes_with": {"type": "string"},
        "views": {"type": "array", "minItems": 1, "items": {"type": "string"}},
        "accessibility": {"type": "array", "minItems": 1, "items": {"type": "string"}},
        "provenance_shown": {"type": "array", "minItems": 1, "items": {"type": "string"}},
        "capture_record": {"type": "string"}
      }
    },
    "result": {
      "type": "object",
      "required": ["verdict", "statement", "next_bounded_experiment"],
      "additionalProperties": false,
      "properties": {
        "verdict": {"enum": ["supported", "weakened", "unresolved", "outside_scope"]},
        "statement": {"type": "string", "minLength": 1},
        "next_bounded_experiment": {"type": "string", "minLength": 1}
      }
    },
    "panels": {"type": "object", "description": "Track-specific, recomputable data. Keys are defined by the track's builder and viewer module."}
  },
  "$defs": {
    "sha256": {"type": "string", "pattern": "^[0-9a-f]{64}$"},
    "hashed_file": {"type": "object", "required": ["path", "sha256"],
                    "properties": {"path": {"type": "string"}, "sha256": {"$ref": "#/$defs/sha256"}}},
    "explanation": {"type": "object", "required": ["name", "description", "how_addressed"],
                    "properties": {"name": {"type": "string"}, "description": {"type": "string"},
                                   "how_addressed": {"type": "string"}}},
    "check": {"type": "object", "required": ["name", "description", "expected", "observed", "pass"],
              "properties": {"name": {"type": "string"}, "description": {"type": "string"},
                             "expected": {}, "observed": {}, "pass": {"type": "boolean"}}}
  }
}
