{
 "packet_version": "1",
 "track": "A1",
 "title": "A1 logic evidence packet",
 "generated_at": "2026-10-09T00:28:44Z",
 "question": {
  "text": "Do dsdk.logic's truth tables, model counts, entailment verdicts, strong-Kleene partial evaluation and proof checker give the right answers, as judged by an independently generated oracle and an independent JS reimplementation?",
  "competing_explanations": [
   {
    "name": "correct",
    "description": "dsdk.logic is correct on the exercised inputs.",
    "how_addressed": "Compared against the brute-force fixtures and recomputed in the browser by viewer/parity/logic.mjs."
   },
   {
    "name": "shared_convention_bug",
    "description": "Code and fixtures agree because both use the same wrong convention (e.g. enumeration order, implication).",
    "how_addressed": "Fixtures were generated by an independent script; analytic counts (2^n rows, hand-derived model counts) need no reference code."
   },
   {
    "name": "weak_oracle",
    "description": "The comparisons would pass even if the code were wrong.",
    "how_addressed": "Mutation check (implication as iff) must fail against the oracle; capture.mjs also tampers one value and requires the viewer to flag a disagree mark."
   },
   {
    "name": "js_echoes_python",
    "description": "The JS side agrees only because it copies Python's numbers.",
    "how_addressed": "The viewer recomputes from formula structures alone and never reads Python's answers when computing the JS column."
   }
  ],
  "scope": {
   "claims": [
    "25 fixture formulas: truth tables, model counts, satisfiable/valid flags agree across Python, fixtures and JS.",
    "Wumpus 2x2-corner KB has exactly 3 models; P12 and P21 are entailed safe, P22 is undetermined.",
    "Affirming the consequent is semantically invalid (countermodel) and rejected by the proof checker.",
    "Strong-Kleene examples give the documented KNOWN/UNKNOWN verdicts in Python and JS."
   ],
   "does_not_claim": [
    "Correctness for all formulas (finite sample only; see induction disclaimer).",
    "Any claim about performance or large formulas.",
    "That the Wumpus KB models the real game; only that the stated KB has these models.",
    "The induction claims for all n: executed checks do not prove them. tracks/A1/PROOFS.md does."
   ]
  }
 },
 "input_snapshot": {
  "source": "Repository fixtures fixtures/logic/formulas.json (25 formulas) and fixtures/logic/wumpus_kb.json (Russell & Norvig pit/breeze corner KB); formulas, KB and proof/partial/induction cases are authored inputs, not observed data.",
  "schema": "formulas.json: cases[{name,string,structure,variables,size,truth_table,model_count,satisfiable,valid}]. wumpus_kb.json: variables, premises[{name,string,structure}], models, queries[{name,string,structure,entails,first_countermodel}]. Structures use {op: const|var|not|and|or|implies|iff}.",
  "missingness_meaning": "There is no missing data. 'Unassigned' variables in partial-evaluation examples are UNKNOWN (strong Kleene: evidence insufficient), which dsdk.core keeps distinct from NOT_OBSERVED, INVALID and NOT_APPLICABLE; a countermodel of None means entailment holds, not that data is missing.",
  "files": [
   {
    "path": "fixtures/logic/formulas.json",
    "sha256": "455cad5bcc8d9abdf9a2b76c689ba5dbc13c9ffb5a0103c1dd43726c85fa9ba8"
   },
   {
    "path": "fixtures/logic/wumpus_kb.json",
    "sha256": "22bf1bfb761f348c94beed63c504ddf90384de82b5e3006c4d06319596466d22"
   }
  ]
 },
 "implementation": {
  "module": "dsdk.logic",
  "version": "0.0.1",
  "config": {
   "config_version": "a1-conventions-1",
   "enumeration_order": "sorted variable names, false before true, first variable slowest",
   "partial_semantics": "strong Kleene (truth-functional)",
   "proof_rules": [
    "premise",
    "modus_ponens",
    "modus_tollens",
    "and_intro",
    "and_elim_left",
    "and_elim_right",
    "or_intro_left",
    "or_intro_right",
    "double_negation_elim"
   ],
   "canonical_string_grammar": "formula := atom | '(' '~' formula ')' | '(' formula ' & ' formula ')' | '(' formula ' | ' formula ')' | '(' formula ' -> ' formula ')' | '(' formula ' <-> ' formula ')' ; atom := 'true' | 'false' | NAME ; NAME := [A-Za-z_][A-Za-z0-9_]* except true/false"
  },
  "code_files": [
   {
    "path": "src/dsdk/logic/formula.py",
    "sha256": "df89d9b833feb6224794fab6c293eb40f431c19b5896fb6e48a2013795609e78"
   },
   {
    "path": "src/dsdk/logic/semantics.py",
    "sha256": "b294b726a30c38fdcede663603688df4adbf2bbad3dc6847061a2f92e131851d"
   },
   {
    "path": "src/dsdk/logic/proof.py",
    "sha256": "ac6fb0b582f40e5df66a7e81518a73d14868a0b31a41ff0103f72e1b7eeedf65"
   },
   {
    "path": "src/dsdk/logic/structures.py",
    "sha256": "7829dcfbc32d7cd6cb4105bb7b49f66b52f77575e483aef8144631f993754065"
   },
   {
    "path": "src/dsdk/core/status.py",
    "sha256": "ad9722237122fa079056d81d78b3f594cc2725d91ee9c322e28a323ad999d9e0"
   },
   {
    "path": "viewer/parity/logic.mjs",
    "sha256": "c194611da4bc44baf247b46d96c6f56e6504ddf26ba105621e6968c71715a701"
   }
  ],
  "fixtures": [
   {
    "path": "fixtures/logic/formulas.json",
    "sha256": "455cad5bcc8d9abdf9a2b76c689ba5dbc13c9ffb5a0103c1dd43726c85fa9ba8",
    "representative": [
     "const_true",
     "const_false",
     "var_a",
     "not_a",
     "not_not_a",
     "and_ab",
     "or_ab",
     "implies_ab",
     "iff_ab",
     "excluded_middle",
     "contradiction",
     "const_only_compound",
     "and_left_nested",
     "and_right_nested",
     "modus_ponens_axiom",
     "affirming_consequent",
     "peirce",
     "de_morgan",
     "contrapositive",
     "distribution",
     "xor_ish",
     "or_with_false_const",
     "wumpus_rule_B11",
     "capitalised_names",
     "three_var_chain"
    ]
   },
   {
    "path": "fixtures/logic/wumpus_kb.json",
    "sha256": "22bf1bfb761f348c94beed63c504ddf90384de82b5e3006c4d06319596466d22",
    "representative": [
     "not_P12",
     "not_P21",
     "P12",
     "P21",
     "P22",
     "not_P22",
     "P31",
     "not_P31",
     "P22_or_P31",
     "not_P11",
     "not_P22_and_not_P31"
    ]
   }
  ]
 },
 "oracle": {
  "analytic": [
   {
    "name": "rows_0_vars",
    "description": "A formula over 0 variables has 2^0 truth-table rows.",
    "expected": 1,
    "observed": 1,
    "pass": true
   },
   {
    "name": "rows_1_vars",
    "description": "A formula over 1 variables has 2^1 truth-table rows.",
    "expected": 2,
    "observed": 2,
    "pass": true
   },
   {
    "name": "rows_2_vars",
    "description": "A formula over 2 variables has 2^2 truth-table rows.",
    "expected": 4,
    "observed": 4,
    "pass": true
   },
   {
    "name": "rows_3_vars",
    "description": "A formula over 3 variables has 2^3 truth-table rows.",
    "expected": 8,
    "observed": 8,
    "pass": true
   },
   {
    "name": "rows_4_vars",
    "description": "A formula over 4 variables has 2^4 truth-table rows.",
    "expected": 16,
    "observed": 16,
    "pass": true
   },
   {
    "name": "rows_5_vars",
    "description": "A formula over 5 variables has 2^5 truth-table rows.",
    "expected": 32,
    "observed": 32,
    "pass": true
   },
   {
    "name": "known_model_counts",
    "description": "Hand-derived counts: a&b has 1 model, a|b has 3, exactly-one-of(a,b) has 2.",
    "expected": {
     "and_ab_models": 1,
     "or_ab_models": 3,
     "xor_like_models": 2
    },
    "observed": {
     "and_ab_models": 1,
     "or_ab_models": 3,
     "xor_like_models": 2
    },
    "pass": true
   },
   {
    "name": "or_three_vars_models",
    "description": "a|b|c has 2^3 - 1 = 7 models.",
    "expected": 7,
    "observed": 7,
    "pass": true
   }
  ],
  "independent_reference": {
   "description": "Fixtures were produced by a separate brute-force script (not dsdk); dsdk is run fresh and compared. The browser adds a second independent implementation (viewer/parity/logic.mjs, plus partial evaluation, countermodel and proof checking in viewer/a1.mjs).",
   "comparisons": [
    {
     "name": "formulas.json: strings, variables, size, truth tables, model counts, satisfiable, valid",
     "compared": 25,
     "mismatches": 0
    },
    {
     "name": "wumpus_kb.json: model list/order, model_count, 11 entailment verdicts and first countermodels",
     "compared": 13,
     "mismatches": 0
    }
   ]
  },
  "boundary_cases": [
   {
    "name": "zero_variables_one_row",
    "description": "A constant-only formula has exactly one (empty) assignment.",
    "expected": 1,
    "observed": 1,
    "pass": true
   },
   {
    "name": "contradiction_zero_models",
    "description": "p & ~p has no models.",
    "expected": 0,
    "observed": 0,
    "pass": true
   },
   {
    "name": "tautology_all_models",
    "description": "p | ~p has 2 of 2 models and is valid.",
    "expected": [
     2,
     true
    ],
    "observed": [
     2,
     true
    ],
    "pass": true
   },
   {
    "name": "empty_premises_is_validity",
    "description": "Entailment from no premises equals validity.",
    "expected": [
     true,
     false
    ],
    "observed": [
     true,
     false
    ],
    "pass": true
   },
   {
    "name": "contradictory_premises_entail_all",
    "description": "Contradictory premises entail everything (vacuous).",
    "expected": true,
    "observed": true,
    "pass": true
   },
   {
    "name": "evaluate_no_short_circuit_exemption",
    "description": "Two-valued evaluate raises on an unassigned variable even when And(false, x) could short-circuit.",
    "expected": "UnassignedVariableError(x)",
    "observed": "UnassignedVariableError(x)",
    "pass": true
   },
   {
    "name": "partial_eval_decides_without_x",
    "description": "evaluate_partial decides And(false, x) as KNOWN false.",
    "expected": [
     "known",
     false
    ],
    "observed": [
     "known",
     false
    ],
    "pass": true
   },
   {
    "name": "triangular_zero",
    "description": "triangular(0) is the empty sum 0.",